id;dni;nombre;apellido;fecha_nacimiento
1;mobile Fish;Home Loan Account Table Computer;Trace;2022-11-22T05:06:09
2;Metal deposit;Producer;Implementation Electronics Officer;2022-11-21T22:17:31
3;Home Loan Account;web-readiness;Namibia;2022-11-22T03:30:54
4;Gorgeous Frozen Pants;Common;Savings Account syndicate Planner;2022-11-22T01:54:33
5;HDD;Table Small Frozen Sausages Planner;envisioneer Music Public-key;2022-11-22T07:19:37
6;Bahamian Dollar Investment Account;Games Regional Digitized;copy convergence;2022-11-22T08:07:15
7;Georgia Industrial;connect Markets Chief;capacitor archive;2022-11-21T23:25:15
8;Aruba;software scale interactive;Louisiana Specialist Home Loan Account;2022-11-22T06:29:15
9;scalable;Small;deliverables reinvent 24 hour;2022-11-22T12:46:25
10;magenta monitor 1080p;Unbranded Plastic Tuna Frozen;generating Highway Ergonomic;2022-11-22T04:12:43
